link,headline,author,date_published
https://www.nydailynews.com/2025/08/07/zohran-mamdani-shsat-specialized-high-school-exam/,"Zohran Mamdani, once against the specialized high school admissions exam, explains his turnaround",Cayla Bamberger,2025-08-07 17:43:04
https://www.nydailynews.com/2024/12/18/nyc-education-panel-approves-digital-version-of-exam-to-specialized-high-schools/,NYC education panel approves digital version of exam to specialized high schools,Cayla Bamberger,2024-12-18 23:36:05
https://www.nydailynews.com/2024/11/23/push-to-digitize-nyc-entrance-exam-for-specialized-high-schools-reignites-equity-debate/,Push to digitize NYC entrance exam for specialized high schools reignites equity debate,Cayla Bamberger,2024-11-23 16:00:52
https://www.nydailynews.com/2024/05/07/putting-the-test-to-the-test-nycs-specialized-high-school-exam-does-not-aim-to-exclude-minorities/,Putting the test to the test: NYC’s Specialized High School exam does not aim to exclude minorities,New York Daily News Editorial Board,2024-05-07 04:00:46
https://www.nydailynews.com/2024/05/15/city-still-paying-big-for-ex-mayors-shortcuts/,City still paying big for ex-mayor’s shortcuts,Richard Steier,2024-05-15 05:00:11
https://www.nydailynews.com/2023/02/14/embattled-principal-at-laguardia-high-for-arts-resigns-after-backlash-over-academics/,Embattled principal at LaGuardia High for arts resigns after backlash over academics,Cayla Bamberger,2023-02-14 18:03:18
https://www.nydailynews.com/2021/05/03/women-candidates-for-nyc-mayor-share-vision-for-recovery/,Women candidates for NYC mayor share vision for recovery,Shant Shahrigian,2021-05-03 19:31:04
https://www.nydailynews.com/2021/04/07/andrew-yang-goes-on-defensive-at-teachers-union-forum-for-nyc-mayoral-candidates/,Andrew Yang goes on defensive at teachers’ union forum for NYC mayoral candidates,Shant Shahrigian,2021-04-07 19:25:42
https://www.nydailynews.com/2021/02/07/nyc-mayoral-wannabe-maya-wiley-backs-tax-hikes-for-wealthy-other-progressive-bills/,"NYC mayoral wannabe Maya Wiley backs tax hikes for wealthy, other progressive bills",Shant Shahrigian,2021-02-07 19:07:28
https://www.nydailynews.com/2020/05/27/readers-sound-off-on-energy-opening-churches-and-dangerous-drivers/,"Readers sound off on energy, opening churches and dangerous drivers",Voice of the People,2020-05-26 23:00:00
https://www.nydailynews.com/2019/05/10/ny-politicians-spar-over-elite-high-school-admission-testing/,NY politicians spar over elite high school admission testing,Trevor Boyer,2019-05-12 14:57:41
https://www.nydailynews.com/2019/03/20/keep-the-high-school-admissions-test-but-give-more-blacks-and-latinos-the-tools-to-succeed/,"Keep the high-school admissions test, but give more blacks and Latinos the tools to succeed",Contributed Content,2019-03-21 15:43:14
https://www.nydailynews.com/2019/04/02/welcome-back-to-test-insanity-new-york-states-ever-changing-standardized-tests-in-english-and-math-are-here-again/,Welcome back to test insanity: New York State’s ever-changing standardized tests in English and math are here again,Fred Smith,2019-04-02 13:39:12
https://www.nydailynews.com/2018/07/30/lawmakers-stage-fresh-push-against-mayor-de-blasios-school-desegregation-plan/,Lawmakers stage fresh push against Mayor de Blasio’s school desegregation plan,Ben Chapman,2018-12-12 23:33:40
https://www.nydailynews.com/2018/03/14/fewer-girls-than-boys-accepted-into-top-ny-high-schools-even-though-more-of-them-tried-out/,Fewer girls than boys accepted into top N.Y. high schools even though more of them tried out,Ben Chapman,2018-04-07 00:15:19
https://www.nydailynews.com/2018/06/17/readers-sound-off-on-fifa-fathers-day-and-fonts/,"Readers sound off on FIFA, Father’s Day and fonts",Voice of the People,2018-12-13 07:33:10
https://www.nydailynews.com/2017/03/08/de-blasios-shsat-test-changes-too-timid-to-improve-diversity-at-stuyvesant-bronx-science-brooklyn-tech-and-other-schools/,"De Blasio’s SHSAT test changes: Too timid to improve diversity at Stuyvesant, Bronx Science, Brooklyn Tech and other schools",Contributed Content,2018-04-06 17:44:54
https://www.nydailynews.com/2011/04/10/making-stuyvesant-a-place-for-all-too-few-minorities-attend-our-best-schools/,Making Stuyvesant a place for all: Too few minorities attend our best schools,Tom Allon,2019-01-13 03:41:57
